[
{ "pedidoId": "P001", "clienteId": "C001", "fechaPedido": "2025-02-01T10:00:00Z", "totalMonto": 120.5, "estado": "Completado" },
  { "pedidoId": "P002", "clienteId": "C001", "fechaPedido": "2025-03-10T09:45:00Z", "totalMonto": 85, "estado": "Pendiente de Pago" },
  { "pedidoId": "P003", "clienteId": "C002", "fechaPedido": "2025-04-12T12:30:00Z", "totalMonto": 45, "estado": "Completado" },
  { "pedidoId": "P004", "clienteId": "C003", "fechaPedido": "2025-01-25T08:15:00Z", "totalMonto": 210.75, "estado": "Cancelado" },
  { "pedidoId": "P005", "clienteId": "C004", "fechaPedido": "2025-05-02T16:10:00Z", "totalMonto": 65.3, "estado": "Completado" },
  { "pedidoId": "P006", "clienteId": "C005", "fechaPedido": "2025-02-14T14:00:00Z", "totalMonto": 180, "estado": "Pendiente de Pago" },
  { "pedidoId": "P007", "clienteId": "C007", "fechaPedido": "2025-04-28T10:40:00Z", "totalMonto": 130.25, "estado": "Completado" },
  { "pedidoId": "P008", "clienteId": "C008", "fechaPedido": "2025-06-15T11:20:00Z", "totalMonto": 95.4, "estado": "Pendiente de Pago" },
  { "pedidoId": "P009", "clienteId": "C009", "fechaPedido": "2025-03-03T13:30:00Z", "totalMonto": 200, "estado": "Completado" },
  { "pedidoId": "P010", "clienteId": "C010", "fechaPedido": "2025-05-19T09:00:00Z", "totalMonto": 40, "estado": "Cancelado" }
]

